{"$schema":"https://json-schema.org/draft/2020-12/schema","$id":"https://local.invalid/lakda/v1/config.schema.json","title":"Lakda v1 configuration","type":"object","additionalProperties":false,"definitions":{"locator":{"type":"object","additionalProperties":false,"properties":{"testId":{"type":"string","minLength":1},"role":{"enum":["button","link","textbox","checkbox","combobox","option","menuitem","tab"]},"name":{"type":"string","minLength":1}}},"action":{"type":"object","additionalProperties":false,"required":["id","kind"],"properties":{"id":{"type":"string","minLength":1},"kind":{"enum":["navigate","goto","click","fill","check","select","press"]},"path":{"type":"string"},"locator":{"$ref":"#/definitions/locator"},"selector":{"type":"string"},"value":{"type":"string"},"accessibleName":{"type":"string"},"inputProfileId":{"type":"string","minLength":1},"key":{"enum":["Enter","Escape","Space","Tab"]},"mutates":{"type":"boolean"}}}},"properties":{"schemaVersion":{"const":"lakda/v1"},"baseUrl":{"type":"string","minLength":1},"mode":{"enum":["smoke","seeded-random","regression-replay","llm-explore","adaptive-explore"]},"browser":{"const":"chromium"},"seed":{"type":"integer"},"persona":{"type":"string","minLength":1},"durationMs":{"type":"integer","minimum":1},"maxActions":{"type":"integer","minimum":1},"workers":{"type":"integer","minimum":1,"maximum":4},"outputDir":{"type":"string","minLength":1},"headed":{"type":"boolean"},"actionCatalog":{"type":"array","items":{"$ref":"#/definitions/action"}},"candidates":{"type":"array","items":{"$ref":"#/definitions/action"}},"inputProfiles":{"type":"object","additionalProperties":{"type":"string"}},"profiles":{"type":"object","additionalProperties":false,"properties":{"smoke":{"type":"object","additionalProperties":false,"required":["actionIds"],"properties":{"actionIds":{"type":"array","minItems":1,"items":{"type":"string","minLength":1}}}},"seededRandom":{"type":"object","additionalProperties":false,"properties":{"candidateIds":{"type":"array","items":{"type":"string","minLength":1}},"count":{"type":"integer","minimum":1}}}}},"classifier":{"type":"object","additionalProperties":false,"properties":{"majorRequestUrlPatterns":{"type":"array","items":{"type":"string"}},"consoleErrorAllowPatterns":{"type":"array","items":{"type":"string"}}}},"personas":{"type":"object","additionalProperties":{"type":"object","additionalProperties":false,"properties":{"storageStatePath":{"type":"string"},"validationPath":{"type":"string"},"loginUrlPattern":{"type":"string"},"requiredLocator":{"$ref":"#/definitions/locator"}}}},"obligations":{"type":"array","items":{"type":"object","additionalProperties":false,"properties":{"expectedUrl":{"type":"string"},"visible":{"$ref":"#/definitions/locator"}}}},"fixtureReset":{"type":"object","additionalProperties":false,"required":["url"],"properties":{"url":{"type":"string","minLength":1}}},"safety":{"type":"object","additionalProperties":false,"properties":{"allowHosts":{"type":"array","items":{"type":"string"}},"denyActionKinds":{"type":"array","items":{"type":"string"}},"maxActionsPerMinute":{"type":"integer","minimum":1},"requireFixtureResetForMutations":{"type":"boolean"},"fixtureResetConfigured":{"type":"boolean"}}},"llm":{"type":"object","additionalProperties":false,"properties":{"enabled":{"type":"boolean"},"baseUrl":{"type":"string"},"expectedModelId":{"type":"string"},"modelSha256":{"type":"string"},"modelPath":{"type":"string"},"runtimeEvidence":{"type":"object","additionalProperties":false,"properties":{"runtimeVersion":{"type":"string"},"runtimeBuild":{"type":"string"},"chatTemplateHash":{"type":"string"}}},"seed":{"type":"integer"},"temperature":{"type":"number"},"topP":{"type":"number"},"maxTokens":{"type":"integer"},"connectTimeoutMs":{"type":"integer"},"requestTimeoutMs":{"type":"integer"},"maxRetries":{"type":"integer","minimum":0,"maximum":2}}},"artifacts":{"type":"object","additionalProperties":false,"properties":{"classification":{"enum":["public","internal","confidential","restricted"]},"trace":{"const":"retain-on-non-pass"},"screenshot":{"const":"retain-on-non-pass"},"video":{"default":"retain-on-non-pass","anyOf":[{"type":"boolean"},{"const":"retain-on-non-pass"}]},"har":{"type":"boolean"},"domSnapshots":{"type":"boolean"},"maxRunBytes":{"type":"integer","minimum":1}}},"extensions":{"type":"object","additionalProperties":false,"properties":{"combinations":{"type":"object","additionalProperties":false,"properties":{"caseBudget":{"type":"integer","minimum":1},"defaultStrength":{"type":"integer","minimum":2}}},"scouting":{"type":"object","additionalProperties":false,"properties":{"mode":{"enum":["rule-only","loopback"]},"leadCap":{"type":"integer","minimum":1,"maximum":3}}}}},"adaptive":{"type":"object","additionalProperties":false,"required":["schemaVersion","adapter","generator","stopWhen","settlePolicy","fingerprintPolicy","recovery","safety"],"properties":{"schemaVersion":{"const":"lakda/adaptive-config/v1"},"adapter":{"type":"object","additionalProperties":false,"required":["id"],"properties":{"id":{"enum":["playwright","airtest-poco","security"]},"endpoint":{"type":"string"},"initialTarget":{"type":"object","additionalProperties":false,"required":["targetId","kind"],"properties":{"targetId":{"type":"string","minLength":1},"kind":{"enum":["page","frame","dialog","device","surface","http"]},"contextId":{"type":"string"},"parentTargetId":{"type":"string"},"framePath":{"type":"array","items":{"type":"string"}},"origin":{"type":"string"},"lifecycle":{"enum":["active","closed","lost"]}}}}},"generator":{"type":"object","additionalProperties":false,"required":["strategy"],"properties":{"strategy":{"enum":["random","weighted-random","autonomous-uncovered","least-visited-transition","shortest-to-uncovered","risk-weighted-uncovered","llm-select"]},"version":{"type":"string"}}},"actionContracts":{"type":"array","items":{"type":"object","additionalProperties":false,"required":["actionId","mutationKind"],"properties":{"actionId":{"type":"string","minLength":1},"mutationKind":{"enum":["none","create","update","delete","purchase","publish","external-message","credential-change","parameter-mutation","skip","reorder","double-execution","race","unknown"]}}}},"stopWhen":{"type":"object","additionalProperties":false,"properties":{"any":{"type":"array","minItems":1,"items":{"type":"object"}},"all":{"type":"array","minItems":1,"items":{"type":"object"}}},"anyOf":[{"required":["any"]},{"required":["all"]}]},"settlePolicy":{"type":"object","additionalProperties":false,"required":["policyVersion","maxWaitMs","stableWindowMs"],"properties":{"policyVersion":{"type":"string","minLength":1},"maxWaitMs":{"type":"integer","minimum":1},"stableWindowMs":{"type":"integer","minimum":0},"readiness":{"type":"object","additionalProperties":false,"properties":{"testId":{"type":"string","minLength":1},"role":{"type":"string","minLength":1},"name":{"type":"string","minLength":1},"state":{"enum":["visible","hidden"]}}}}},"fingerprintPolicy":{"type":"object","additionalProperties":false,"required":["algorithmVersion","canonicalizationVersion"],"properties":{"algorithmVersion":{"type":"string","minLength":1},"canonicalizationVersion":{"type":"string","minLength":1}}},"recovery":{"type":"object","additionalProperties":false,"required":["maxBacktracks","maxAttemptsPerState"],"properties":{"maxBacktracks":{"type":"integer","minimum":0},"maxAttemptsPerState":{"type":"integer","minimum":1}}},"safety":{"type":"object","additionalProperties":false,"required":["allowTargetKinds","denyActionIds","allowMutationKinds"],"properties":{"allowTargetKinds":{"type":"array","minItems":1,"items":{"enum":["page","frame","dialog","device","surface","http"]}},"denyActionIds":{"type":"array","items":{"type":"string"}},"allowMutationKinds":{"type":"array","items":{"enum":["none","create","update","delete","purchase","publish","external-message","credential-change","parameter-mutation","skip","reorder","double-execution","race","unknown"]}}}},"securityProfileRef":{"type":"string","minLength":1},"securityEnvironment":{"enum":["local","staging","production"]},"securityAuthorization":{"type":"object","additionalProperties":false,"required":["schemaVersion","authorizationId","owner","targets","environment","validFrom","validUntil","allowedMutationKinds","maxRatePerMinute","maxConcurrency","cleanupRef","killSwitchRef","approvalEvidenceRef","dataPolicyRef","stopContactRef","binding","signature"],"properties":{"schemaVersion":{"const":"lakda/security-authorization/v2"},"authorizationId":{"type":"string","minLength":1},"owner":{"type":"string","minLength":1},"targets":{"type":"object","additionalProperties":false,"required":["hosts","pathPrefixes","methods","requestTemplateDigests","targetRevision"],"properties":{"hosts":{"type":"array","minItems":1,"uniqueItems":true,"items":{"type":"string","minLength":1}},"pathPrefixes":{"type":"array","minItems":1,"uniqueItems":true,"items":{"type":"string","pattern":"^/"}},"methods":{"type":"array","minItems":1,"uniqueItems":true,"items":{"type":"string","pattern":"^[A-Z]+$"}},"requestTemplateDigests":{"type":"array","minItems":1,"uniqueItems":true,"items":{"type":"string","pattern":"^sha256:[0-9a-f]{64}$"}},"targetRevision":{"type":"string","minLength":1}}},"environment":{"enum":["local","staging","production"]},"validFrom":{"type":"string","minLength":1},"validUntil":{"type":"string","minLength":1},"allowedMutationKinds":{"type":"array","items":{"enum":["none","create","update","delete","purchase","publish","external-message","credential-change","parameter-mutation","skip","reorder","double-execution","race","unknown"]}},"maxRatePerMinute":{"type":"integer","minimum":1},"maxConcurrency":{"type":"integer","minimum":1},"cleanupRef":{"type":"string","minLength":1},"killSwitchRef":{"type":"string","minLength":1},"approvalEvidenceRef":{"type":"string","minLength":1},"dataPolicyRef":{"type":"string","minLength":1},"stopContactRef":{"type":"string","minLength":1},"binding":{"type":"object","additionalProperties":false,"required":["securityProfileDigest","capabilityDigest","bridgeDigest"],"properties":{"securityProfileDigest":{"type":"string","pattern":"^sha256:[0-9a-f]{64}$"},"capabilityDigest":{"type":"string","pattern":"^sha256:[0-9a-f]{64}$"},"bridgeDigest":{"type":"string","pattern":"^sha256:[0-9a-f]{64}$"}}},"signature":{"type":"object","additionalProperties":false,"required":["algorithm","signedPayloadDigest","signatureRef"],"properties":{"algorithm":{"const":"ed25519"},"signedPayloadDigest":{"type":"string","pattern":"^sha256:[0-9a-f]{64}$"},"signatureRef":{"type":"string","minLength":1}}}}}}}}}
